{
  "$schema": "../SectionDoc.schema.json",
  "clause": "29.11",
  "title": "Shared Memory Guidelines",
  "status": "Not Yet Supported",
  "specUrl": "https://tc39.es/ecma262/#sec-shared-memory-guidelines",
  "parent": {
    "clause": "29"
  },
  "autoGeneratedHeader": true,
  "intro": "This clause is guidance for engines that expose shared memory. JROC does not currently expose shared-memory primitives, so this material is tracked as informational background only."
}
