{
  "$schema": "../SectionDoc.schema.json",
  "clause": "9.13",
  "title": "CanBeHeldWeakly ( v )",
  "status": "Supported",
  "specUrl": "https://tc39.es/ecma262/#CanBeHeldWeakly",
  "parent": {
    "clause": "9"
  },
  "autoGeneratedHeader": true,
  "support": {
    "entries": [
      {
        "clause": "9.13",
        "feature": "CanBeHeldWeakly ( v )",
        "status": "Supported",
        "specUrl": "https://tc39.es/ecma262/#CanBeHeldWeakly",
        "testScripts": [
          "tests/Jroc.Tests/WeakRef/JavaScript/WeakRef_Deref_KeptObjects.js",
          "tests/Jroc.Tests/FinalizationRegistry/JavaScript/FinalizationRegistry_Unregister_Basic.js"
        ],
        "test262Paths": [
          "test/built-ins/WeakRef/throws-when-target-cannot-be-held-weakly.js"
        ],
        "notes": "TypeUtilities.CanBeHeldWeakly accepts objects and non-registered symbols, including well-known symbols, and rejects registered Symbol.for values, null, undefined and other primitives. Symbol registration is checked against the current agent's global symbol registry. WeakMap, WeakSet, WeakRef and FinalizationRegistry share this predicate; the separate collection/cleanup timing limitations do not change this eligibility decision."
      }
    ]
  }
}
