{
  "$schema": "../SectionDoc.schema.json",
  "clause": "9.5",
  "title": "Jobs and Host Operations to Enqueue Jobs",
  "status": "Supported with Limitations",
  "specUrl": "https://tc39.es/ecma262/#sec-jobs",
  "parent": {
    "clause": "9"
  },
  "autoGeneratedHeader": true,
  "subclauses": [
    {
      "clause": "9.5.1",
      "title": "JobCallback Records",
      "status": "Supported",
      "specUrl": "https://tc39.es/ecma262/#sec-jobcallback-records"
    },
    {
      "clause": "9.5.2",
      "title": "HostMakeJobCallback ( callback )",
      "status": "Supported",
      "specUrl": "https://tc39.es/ecma262/#sec-hostmakejobcallback"
    },
    {
      "clause": "9.5.3",
      "title": "HostCallJobCallback ( jobCallback , V , argumentsList )",
      "status": "Supported",
      "specUrl": "https://tc39.es/ecma262/#sec-hostcalljobcallback"
    },
    {
      "clause": "9.5.4",
      "title": "HostEnqueueGenericJob ( job , realm )",
      "status": "Supported with Limitations",
      "specUrl": "https://tc39.es/ecma262/#sec-hostenqueuegenericjob"
    },
    {
      "clause": "9.5.5",
      "title": "HostEnqueuePromiseJob ( job , realm )",
      "status": "Supported with Limitations",
      "specUrl": "https://tc39.es/ecma262/#sec-hostenqueuepromisejob"
    },
    {
      "clause": "9.5.6",
      "title": "HostEnqueueTimeoutJob ( timeoutJob , realm , milliseconds )",
      "status": "Supported with Limitations",
      "specUrl": "https://tc39.es/ecma262/#sec-hostenqueuetimeoutjob"
    }
  ],
  "reference": {
    "mode": "stub",
    "note": "_Intentionally not included here. Use the tc39.es links above as the normative reference._"
  },
  "support": {
    "entries": [
      {
        "clause": "9.5.1",
        "feature": "JobCallback Records",
        "status": "Supported",
        "specUrl": "https://tc39.es/ecma262/#sec-jobcallback-records",
        "testScripts": [
          "tests/Jroc.Tests/Promise/JavaScript/Promise_Resolve_Then.js",
          "tests/Jroc.Tests/Promise/JavaScript/Promise_Scheduling_StarvationTest.js"
        ],
        "notes": "Implemented as internal JobCallback records carrying callback plus host-defined payload slot."
      },
      {
        "clause": "9.5.2",
        "feature": "HostMakeJobCallback",
        "status": "Supported",
        "specUrl": "https://tc39.es/ecma262/#sec-hostmakejobcallback",
        "testScripts": [
          "tests/Jroc.Tests/Promise/JavaScript/Promise_Resolve_Then.js"
        ],
        "notes": "Host operation wraps callbacks in JobCallbackRecord for queueing/invocation."
      },
      {
        "clause": "9.5.3",
        "feature": "HostCallJobCallback",
        "status": "Supported",
        "specUrl": "https://tc39.es/ecma262/#sec-hostcalljobcallback",
        "testScripts": [
          "tests/Jroc.Tests/Promise/JavaScript/Promise_Resolve_Then.js"
        ],
        "notes": "Host operation invokes stored job callback; JROC currently uses Action-based jobs for Promise reactions."
      },
      {
        "clause": "9.5.4",
        "feature": "HostEnqueueGenericJob",
        "status": "Supported with Limitations",
        "specUrl": "https://tc39.es/ecma262/#sec-hostenqueuegenericjob",
        "testScripts": [
          "tests/Jroc.Tests/Promise/JavaScript/Promise_Scheduling_StarvationTest.js",
          "tests/Jroc.Tests/Node/Process/JavaScript/Process_NextTick_And_Promise_Ordering.js"
        ],
        "notes": "Generic host job enqueuing is modeled through NodeSchedulerState/EventLoopPump queues; realm-specific behavior is limited."
      },
      {
        "clause": "9.5.5",
        "feature": "HostEnqueuePromiseJob",
        "status": "Supported with Limitations",
        "specUrl": "https://tc39.es/ecma262/#sec-hostenqueuepromisejob",
        "testScripts": [
          "tests/Jroc.Tests/Promise/JavaScript/Promise_Resolve_Then.js",
          "tests/Jroc.Tests/Promise/JavaScript/Promise_Scheduling_StarvationTest.js"
        ],
        "notes": "Promise reactions enqueue microtasks via IMicrotaskScheduler and are drained by the event-loop microtask checkpoints."
      },
      {
        "clause": "9.5.6",
        "feature": "HostEnqueueTimeoutJob",
        "status": "Supported with Limitations",
        "specUrl": "https://tc39.es/ecma262/#sec-hostenqueuetimeoutjob",
        "testScripts": [
          "tests/Jroc.Tests/Node/Timers/JavaScript/SetTimeout_ZeroDelay.js",
          "tests/Jroc.Tests/Node/Timers/JavaScript/SetInterval_ExecutesThreeTimes_ThenClears.js"
        ],
        "notes": "Timers enqueue timeout jobs through scheduler timer queues (setTimeout/setInterval) with host-specific event loop behavior."
      }
    ]
  }
}
