{
  "$schema": "../SectionDoc.schema.json",
  "clause": "29.5",
  "title": "Abstract Operations for the Memory Model",
  "status": "Not Yet Supported",
  "specUrl": "https://tc39.es/ecma262/#sec-abstract-operations-for-the-memory-model",
  "parent": {
    "clause": "29"
  },
  "autoGeneratedHeader": true,
  "subclauses": [
    {
      "clause": "29.5.1",
      "title": "EventSet ( execution )",
      "status": "Not Yet Supported",
      "specUrl": "https://tc39.es/ecma262/#sec-event-set"
    },
    {
      "clause": "29.5.2",
      "title": "SharedDataBlockEventSet ( execution )",
      "status": "Not Yet Supported",
      "specUrl": "https://tc39.es/ecma262/#sec-sharedatablockeventset"
    },
    {
      "clause": "29.5.3",
      "title": "HostEventSet ( execution )",
      "status": "Not Yet Supported",
      "specUrl": "https://tc39.es/ecma262/#sec-hosteventset"
    },
    {
      "clause": "29.5.4",
      "title": "ComposeWriteEventBytes ( execution , byteIndex , Ws )",
      "status": "Not Yet Supported",
      "specUrl": "https://tc39.es/ecma262/#sec-composewriteeventbytes"
    },
    {
      "clause": "29.5.5",
      "title": "ValueOfReadEvent ( execution , R )",
      "status": "Not Yet Supported",
      "specUrl": "https://tc39.es/ecma262/#sec-valueofreadevent"
    }
  ]
}
