{
  "$schema": "../SectionDoc.schema.json",
  "clause": "9.4",
  "title": "Execution Contexts",
  "status": "Supported with Limitations",
  "specUrl": "https://tc39.es/ecma262/#sec-execution-contexts",
  "parent": {
    "clause": "9"
  },
  "autoGeneratedHeader": true,
  "intro": "RuntimeExecutionContext frames select the realm, global object, module location and active require state, while RuntimeServices invocation frames carry this, arguments, new.target and callee state. Compiler lowering supplies lexical and module origins for supported call paths. Full general ScriptOrModule record tracking and general eval are not implemented.",
  "subclauses": [
    {
      "clause": "9.4.1",
      "title": "GetActiveScriptOrModule ( )",
      "status": "Supported with Limitations",
      "specUrl": "https://tc39.es/ecma262/#sec-getactivescriptormodule"
    },
    {
      "clause": "9.4.2",
      "title": "ResolveBinding ( name [ , env ] )",
      "status": "Supported with Limitations",
      "specUrl": "https://tc39.es/ecma262/#sec-resolvebinding"
    },
    {
      "clause": "9.4.3",
      "title": "GetThisEnvironment ( )",
      "status": "Supported with Limitations",
      "specUrl": "https://tc39.es/ecma262/#sec-getthisenvironment"
    },
    {
      "clause": "9.4.4",
      "title": "ResolveThisBinding ( )",
      "status": "Supported with Limitations",
      "specUrl": "https://tc39.es/ecma262/#sec-resolvethisbinding"
    },
    {
      "clause": "9.4.5",
      "title": "GetNewTarget ( )",
      "status": "Supported with Limitations",
      "specUrl": "https://tc39.es/ecma262/#sec-getnewtarget"
    },
    {
      "clause": "9.4.6",
      "title": "GetGlobalObject ( )",
      "status": "Supported with Limitations",
      "specUrl": "https://tc39.es/ecma262/#sec-getglobalobject"
    }
  ],
  "support": {
    "entries": [
      {
        "clause": "9.4.2",
        "feature": "ResolveBinding over lexical/function/global scope chains",
        "status": "Supported with Limitations",
        "specUrl": "https://tc39.es/ecma262/#sec-resolvebinding",
        "testScripts": [
          "tests/Jroc.Tests/SymbolTableBuilderTests.cs",
          "tests/Jroc.Tests/Variable/JavaScript/Variable_LetBlockScope.js"
        ],
        "notes": "Binding resolution is handled by symbol table analysis and lowered scope access paths for supported constructs."
      },
      {
        "clause": "9.4.4",
        "feature": "ResolveThisBinding for function/method/arrow contexts",
        "status": "Supported with Limitations",
        "specUrl": "https://tc39.es/ecma262/#sec-resolvethisbinding",
        "testScripts": [
          "tests/Jroc.Tests/Function/JavaScript/Function_ObjectLiteralMethod_ThisBinding.js",
          "tests/Jroc.Tests/ArrowFunction/JavaScript/ArrowFunction_LexicalThis_CreatedInMethod.js"
        ],
        "notes": "this binding is modeled via RuntimeServices with lexical-this behavior for arrows in supported call paths."
      },
      {
        "clause": "9.4.5",
        "feature": "GetNewTarget semantics in constructor/call flows",
        "status": "Supported with Limitations",
        "specUrl": "https://tc39.es/ecma262/#sec-getnewtarget",
        "testScripts": [
          "tests/Jroc.Tests/Function/JavaScript/Function_NewTarget_NewVsCall.js",
          "tests/Jroc.Tests/Function/JavaScript/Function_NewTarget_Arrow_Inherits.js",
          "tests/Jroc.Tests/Function/JavaScript/Function_GeneratedConstruction_Semantics.js"
        ],
        "notes": "new.target is propagated through generated function construction adapters and runtime call helpers, including alternate Reflect.construct targets, bound constructors, arrows, and derived classes with function-valued bases."
      },
      {
        "clause": "9.4.6",
        "feature": "GetGlobalObject access via GlobalThis",
        "status": "Supported with Limitations",
        "specUrl": "https://tc39.es/ecma262/#sec-getglobalobject",
        "testScripts": [
          "tests/Jroc.Tests/ValidatorTests.cs",
          "tests/Jroc.Tests/Node/Process/JavaScript/Process_Platform_Versions_And_Env_Basics.js"
        ],
        "notes": "Global object access is provided through the runtime GlobalThis object and host bootstrap wiring."
      },
      {
        "clause": "9.4.1",
        "feature": "Active module origin in supported execution paths (GetActiveScriptOrModule)",
        "status": "Supported with Limitations",
        "specUrl": "https://tc39.es/ecma262/#sec-getactivescriptormodule",
        "testScripts": [
          "tests/Jroc.Tests/RuntimeExecutionContextTests.cs",
          "tests/Jroc.Tests/RuntimeModuleStateTests.cs",
          "tests/Jroc.Tests/Import/JavaScript/Import_DynamicImport_Esm_Namespace.js",
          "tests/Jroc.Tests/Import/JavaScript/Import_ImportMeta_Url.js"
        ],
        "notes": "Nested execution frames preserve and restore module locations and active require parents. Compiled dynamic imports receive an explicit defining-module identifier, and import.meta and require delegates are cached per realm and module. This supplies module origin for supported compiled paths without implementing the full general ScriptOrModule record stack or general eval."
      }
    ]
  }
}
