{
  "$schema": "../SectionDoc.schema.json",
  "clause": "14.13",
  "title": "Labelled Statements",
  "status": "Supported with Limitations",
  "specUrl": "https://tc39.es/ecma262/#sec-labelled-statements",
  "parent": {
    "clause": "14"
  },
  "autoGeneratedHeader": true,
  "subclauses": [
    {
      "clause": "14.13.1",
      "title": "Static Semantics: Early Errors",
      "status": "Supported with Limitations",
      "specUrl": "https://tc39.es/ecma262/#sec-labelled-statements-static-semantics-early-errors"
    },
    {
      "clause": "14.13.2",
      "title": "Static Semantics: IsLabelledFunction ( stmt )",
      "status": "Supported with Limitations",
      "specUrl": "https://tc39.es/ecma262/#sec-islabelledfunction"
    },
    {
      "clause": "14.13.3",
      "title": "Runtime Semantics: Evaluation",
      "status": "Supported",
      "specUrl": "https://tc39.es/ecma262/#sec-labelled-statements-runtime-semantics-evaluation"
    },
    {
      "clause": "14.13.4",
      "title": "Runtime Semantics: LabelledEvaluation",
      "status": "Supported",
      "specUrl": "https://tc39.es/ecma262/#sec-runtime-semantics-labelledevaluation"
    }
  ],
  "support": {
    "entries": [
      {
        "clause": "14.13.4",
        "feature": "labels used for labeled break/continue",
        "status": "Supported",
        "specUrl": "https://tc39.es/ecma262/#sec-runtime-semantics-labelledevaluation",
        "testScripts": [
          "tests/Jroc.Tests/ControlFlow/JavaScript/ControlFlow_ForLoop_LabeledBreak.js",
          "tests/Jroc.Tests/ControlFlow/JavaScript/ControlFlow_ForLoop_LabeledContinue.js",
          "tests/Jroc.Tests/ControlFlow/JavaScript/ControlFlow_While_LabeledBreak.js",
          "tests/Jroc.Tests/ControlFlow/JavaScript/ControlFlow_While_LabeledContinue.js",
          "tests/Jroc.Tests/ControlFlow/JavaScript/ControlFlow_DoWhile_LabeledBreak.js",
          "tests/Jroc.Tests/ControlFlow/JavaScript/ControlFlow_DoWhile_LabeledContinue.js",
          "tests/Jroc.Tests/ControlFlow/JavaScript/ControlFlow_ForOf_LabeledBreak.js",
          "tests/Jroc.Tests/ControlFlow/JavaScript/ControlFlow_ForOf_LabeledContinue.js",
          "tests/Jroc.Tests/ControlFlow/JavaScript/ControlFlow_ForIn_LabeledBreak.js",
          "tests/Jroc.Tests/ControlFlow/JavaScript/ControlFlow_ForIn_LabeledContinue.js",
          "tests/Jroc.Tests/ControlFlow/JavaScript/ControlFlow_Switch_LabeledBreak.js",
          "tests/Jroc.Test262.Tests/language/statements/labeled/JavaScript/cptn-break.js",
          "tests/Jroc.Test262.Tests/language/statements/labeled/JavaScript/cptn-nrml.js"
        ],
        "notes": "Supports label targeting for break/continue across nested statements and the non-eval labeled completion scenarios covered by the test262 ports. Annex-B labeled function semantics are not exhaustively tested."
      },
      {
        "clause": "14.13.4",
        "feature": "labels consumed by nested break and continue ports",
        "status": "Supported",
        "specUrl": "https://tc39.es/ecma262/#sec-runtime-semantics-labelledevaluation",
        "testScripts": [
          "tests/Jroc.Test262.Tests/language/statements/break/JavaScript/S12.8_A4_T1.js",
          "tests/Jroc.Test262.Tests/language/statements/break/JavaScript/S12.8_A4_T2.js",
          "tests/Jroc.Test262.Tests/language/statements/break/JavaScript/S12.8_A4_T3.js",
          "tests/Jroc.Test262.Tests/language/statements/continue/JavaScript/S12.7_A9_T1.js",
          "tests/Jroc.Test262.Tests/language/statements/continue/JavaScript/line-terminators.js"
        ],
        "notes": "The expanded test262 slice covers label-targeted break/continue across nested loops and the line-terminator case where `continue` must be treated as unlabeled."
      },
      {
        "clause": "14.13.1",
        "feature": "labeled statement early errors",
        "status": "Supported",
        "specUrl": "https://tc39.es/ecma262/#sec-labelled-statements-static-semantics-early-errors",
        "testScripts": [
          "tests/Jroc.Test262.Tests/language/statements/labeled/JavaScript/continue.js",
          "tests/Jroc.Test262.Tests/language/statements/labeled/JavaScript/let-array-with-newline.js",
          "tests/Jroc.Test262.Tests/language/statements/labeled/JavaScript/decl-const.js"
        ],
        "notes": "The added ports cover parser rejection for invalid labeled continue targets, the `let [` lookahead restriction, and lexical declarations used directly as labelled items."
      },
      {
        "clause": "14.13.3",
        "feature": "labeled identifier forms accepted in non-strict code",
        "status": "Supported",
        "specUrl": "https://tc39.es/ecma262/#sec-labelled-statements-runtime-semantics-evaluation",
        "testScripts": [
          "tests/Jroc.Test262.Tests/language/statements/labeled/JavaScript/let-identifier-with-newline.js",
          "tests/Jroc.Test262.Tests/language/statements/labeled/JavaScript/value-yield-non-strict-escaped.js"
        ],
        "notes": "The current slice also covers non-strict forms where `let <bindingIdentifier>` and an escaped `yield` token remain valid label identifiers."
      },
      {
        "clause": "14.13",
        "feature": "Statement syntax parse-negative conformance expansion",
        "status": "Supported with Limitations",
        "specUrl": "https://tc39.es/ecma262/#sec-labelled-statements",
        "testScripts": [
          "tests/Jroc.Test262.Tests/language/statements/StatementSyntaxConformance8BatchParseTests.cs"
        ],
        "test262Paths": [
          "test/language/statements/labeled/decl-async-function.js",
          "test/language/statements/labeled/decl-async-generator.js"
        ],
        "notes": "The native Test262 harness verifies 9 additional pinned parse-negative statement fixtures (9 `labeled`). All 15 metadata-selected variants passed the catalog preflight under one current compiler provenance; no compiler, runtime, or harness changes were required."
      }
    ]
  }
}
