{
  "$schema": "../SectionDoc.schema.json",
  "clause": "4.4",
  "title": "Terms and Definitions",
  "status": "N/A (informational)",
  "specUrl": "https://tc39.es/ecma262/#sec-terms-and-definitions",
  "parent": {
    "clause": "4"
  },
  "autoGeneratedHeader": true,
  "subclauses": [
    {
      "clause": "4.4.1",
      "title": "implementation-approximated",
      "status": "N/A (informational)",
      "specUrl": "https://tc39.es/ecma262/#sec-terms-and-definitions-implementation-approximated"
    },
    {
      "clause": "4.4.2",
      "title": "implementation-defined",
      "status": "N/A (informational)",
      "specUrl": "https://tc39.es/ecma262/#sec-terms-and-definitions-implementation-defined"
    },
    {
      "clause": "4.4.3",
      "title": "host-defined",
      "status": "N/A (informational)",
      "specUrl": "https://tc39.es/ecma262/#sec-terms-and-definitions-host-defined"
    },
    {
      "clause": "4.4.4",
      "title": "type",
      "status": "N/A (informational)",
      "specUrl": "https://tc39.es/ecma262/#sec-type"
    },
    {
      "clause": "4.4.5",
      "title": "primitive value",
      "status": "N/A (informational)",
      "specUrl": "https://tc39.es/ecma262/#sec-primitive-value"
    },
    {
      "clause": "4.4.6",
      "title": "object",
      "status": "N/A (informational)",
      "specUrl": "https://tc39.es/ecma262/#sec-terms-and-definitions-object"
    },
    {
      "clause": "4.4.7",
      "title": "constructor",
      "status": "N/A (informational)",
      "specUrl": "https://tc39.es/ecma262/#sec-constructor"
    },
    {
      "clause": "4.4.8",
      "title": "prototype",
      "status": "N/A (informational)",
      "specUrl": "https://tc39.es/ecma262/#sec-terms-and-definitions-prototype"
    },
    {
      "clause": "4.4.9",
      "title": "ordinary object",
      "status": "N/A (informational)",
      "specUrl": "https://tc39.es/ecma262/#sec-ordinary-object"
    },
    {
      "clause": "4.4.10",
      "title": "exotic object",
      "status": "N/A (informational)",
      "specUrl": "https://tc39.es/ecma262/#sec-exotic-object"
    },
    {
      "clause": "4.4.11",
      "title": "standard object",
      "status": "N/A (informational)",
      "specUrl": "https://tc39.es/ecma262/#sec-standard-object"
    },
    {
      "clause": "4.4.12",
      "title": "built-in object",
      "status": "N/A (informational)",
      "specUrl": "https://tc39.es/ecma262/#sec-built-in-object"
    },
    {
      "clause": "4.4.13",
      "title": "undefined value",
      "status": "N/A (informational)",
      "specUrl": "https://tc39.es/ecma262/#sec-undefined-value"
    },
    {
      "clause": "4.4.14",
      "title": "Undefined type",
      "status": "N/A (informational)",
      "specUrl": "https://tc39.es/ecma262/#sec-terms-and-definitions-undefined-type"
    },
    {
      "clause": "4.4.15",
      "title": "null value",
      "status": "N/A (informational)",
      "specUrl": "https://tc39.es/ecma262/#sec-null-value"
    },
    {
      "clause": "4.4.16",
      "title": "Null type",
      "status": "N/A (informational)",
      "specUrl": "https://tc39.es/ecma262/#sec-terms-and-definitions-null-type"
    },
    {
      "clause": "4.4.17",
      "title": "Boolean value",
      "status": "N/A (informational)",
      "specUrl": "https://tc39.es/ecma262/#sec-terms-and-definitions-boolean-value"
    },
    {
      "clause": "4.4.18",
      "title": "Boolean type",
      "status": "N/A (informational)",
      "specUrl": "https://tc39.es/ecma262/#sec-terms-and-definitions-boolean-type"
    },
    {
      "clause": "4.4.19",
      "title": "Boolean object",
      "status": "N/A (informational)",
      "specUrl": "https://tc39.es/ecma262/#sec-boolean-object"
    },
    {
      "clause": "4.4.20",
      "title": "String value",
      "status": "N/A (informational)",
      "specUrl": "https://tc39.es/ecma262/#sec-terms-and-definitions-string-value"
    },
    {
      "clause": "4.4.21",
      "title": "String type",
      "status": "N/A (informational)",
      "specUrl": "https://tc39.es/ecma262/#sec-terms-and-definitions-string-type"
    },
    {
      "clause": "4.4.22",
      "title": "String object",
      "status": "N/A (informational)",
      "specUrl": "https://tc39.es/ecma262/#sec-string-object"
    },
    {
      "clause": "4.4.23",
      "title": "Number value",
      "status": "N/A (informational)",
      "specUrl": "https://tc39.es/ecma262/#sec-terms-and-definitions-number-value"
    },
    {
      "clause": "4.4.24",
      "title": "Number type",
      "status": "N/A (informational)",
      "specUrl": "https://tc39.es/ecma262/#sec-terms-and-definitions-number-type"
    },
    {
      "clause": "4.4.25",
      "title": "Number object",
      "status": "N/A (informational)",
      "specUrl": "https://tc39.es/ecma262/#sec-number-object"
    },
    {
      "clause": "4.4.26",
      "title": "Infinity",
      "status": "N/A (informational)",
      "specUrl": "https://tc39.es/ecma262/#sec-terms-and-definitions-infinity"
    },
    {
      "clause": "4.4.27",
      "title": "NaN",
      "status": "N/A (informational)",
      "specUrl": "https://tc39.es/ecma262/#sec-terms-and-definitions-nan"
    },
    {
      "clause": "4.4.28",
      "title": "BigInt value",
      "status": "N/A (informational)",
      "specUrl": "https://tc39.es/ecma262/#sec-terms-and-definitions-bigint-value"
    },
    {
      "clause": "4.4.29",
      "title": "BigInt type",
      "status": "N/A (informational)",
      "specUrl": "https://tc39.es/ecma262/#sec-terms-and-definitions-bigint-type"
    },
    {
      "clause": "4.4.30",
      "title": "BigInt object",
      "status": "N/A (informational)",
      "specUrl": "https://tc39.es/ecma262/#sec-bigint-object"
    },
    {
      "clause": "4.4.31",
      "title": "Symbol value",
      "status": "N/A (informational)",
      "specUrl": "https://tc39.es/ecma262/#sec-symbol-value"
    },
    {
      "clause": "4.4.32",
      "title": "Symbol type",
      "status": "N/A (informational)",
      "specUrl": "https://tc39.es/ecma262/#sec-terms-and-definitions-symbol-type"
    },
    {
      "clause": "4.4.33",
      "title": "Symbol object",
      "status": "N/A (informational)",
      "specUrl": "https://tc39.es/ecma262/#sec-symbol-object"
    },
    {
      "clause": "4.4.34",
      "title": "function",
      "status": "N/A (informational)",
      "specUrl": "https://tc39.es/ecma262/#sec-terms-and-definitions-function"
    },
    {
      "clause": "4.4.35",
      "title": "built-in function",
      "status": "N/A (informational)",
      "specUrl": "https://tc39.es/ecma262/#sec-built-in-function"
    },
    {
      "clause": "4.4.36",
      "title": "built-in constructor",
      "status": "N/A (informational)",
      "specUrl": "https://tc39.es/ecma262/#sec-built-in-constructor"
    },
    {
      "clause": "4.4.37",
      "title": "property",
      "status": "N/A (informational)",
      "specUrl": "https://tc39.es/ecma262/#sec-property"
    },
    {
      "clause": "4.4.38",
      "title": "method",
      "status": "N/A (informational)",
      "specUrl": "https://tc39.es/ecma262/#sec-method"
    },
    {
      "clause": "4.4.39",
      "title": "built-in method",
      "status": "N/A (informational)",
      "specUrl": "https://tc39.es/ecma262/#sec-built-in-method"
    },
    {
      "clause": "4.4.40",
      "title": "attribute",
      "status": "N/A (informational)",
      "specUrl": "https://tc39.es/ecma262/#sec-attribute"
    },
    {
      "clause": "4.4.41",
      "title": "own property",
      "status": "N/A (informational)",
      "specUrl": "https://tc39.es/ecma262/#sec-own-property"
    },
    {
      "clause": "4.4.42",
      "title": "inherited property",
      "status": "N/A (informational)",
      "specUrl": "https://tc39.es/ecma262/#sec-inherited-property"
    }
  ]
}
