{
  "$schema": "../SectionDoc.schema.json",
  "clause": "12.1",
  "title": "Unicode Format-Control Characters",
  "status": "Supported with Limitations",
  "specUrl": "https://tc39.es/ecma262/#sec-unicode-format-control-characters",
  "parent": {
    "clause": "12"
  },
  "autoGeneratedHeader": true,
  "support": {
    "entries": [
      {
        "clause": "12.1",
        "feature": "Unicode identifier and format-control character syntax",
        "status": "Supported with Limitations",
        "specUrl": "https://tc39.es/ecma262/#sec-unicode-format-control-characters",
        "testScripts": [
          "tests/Jroc.Test262.Tests/language/identifiers/LexicalSourceConformanceBatchTests.cs"
        ],
        "notes": "Eighty-four pinned Test262 identifier fixtures are natively verified, including Unicode IdentifierStart and IdentifierPart versions, escapes, class names, and ZWJ/ZWNJ handling."
      }
    ]
  }
}
