{
  "$schema": "../SectionDoc.schema.json",
  "clause": "13.9",
  "title": "Bitwise Shift Operators",
  "status": "Supported with Limitations",
  "specUrl": "https://tc39.es/ecma262/#sec-bitwise-shift-operators",
  "parent": {
    "clause": "13"
  },
  "autoGeneratedHeader": true,
  "subclauses": [
    {
      "clause": "13.9.1",
      "title": "The Left Shift Operator ( << )",
      "status": "Supported with Limitations",
      "specUrl": "https://tc39.es/ecma262/#sec-left-shift-operator"
    },
    {
      "clause": "13.9.1.1",
      "title": "Runtime Semantics: Evaluation",
      "status": "Supported with Limitations",
      "specUrl": "https://tc39.es/ecma262/#sec-left-shift-operator-runtime-semantics-evaluation"
    },
    {
      "clause": "13.9.2",
      "title": "The Signed Right Shift Operator ( >> )",
      "status": "Supported with Limitations",
      "specUrl": "https://tc39.es/ecma262/#sec-signed-right-shift-operator"
    },
    {
      "clause": "13.9.2.1",
      "title": "Runtime Semantics: Evaluation",
      "status": "Supported with Limitations",
      "specUrl": "https://tc39.es/ecma262/#sec-signed-right-shift-operator-runtime-semantics-evaluation"
    },
    {
      "clause": "13.9.3",
      "title": "The Unsigned Right Shift Operator ( >>> )",
      "status": "Supported with Limitations",
      "specUrl": "https://tc39.es/ecma262/#sec-unsigned-right-shift-operator"
    },
    {
      "clause": "13.9.3.1",
      "title": "Runtime Semantics: Evaluation",
      "status": "Supported with Limitations",
      "specUrl": "https://tc39.es/ecma262/#sec-unsigned-right-shift-operator-runtime-semantics-evaluation"
    }
  ],
  "support": {
    "entries": [
      {
        "clause": "13.9",
        "feature": "Bitwise shift operators",
        "status": "Supported with Limitations",
        "specUrl": "https://tc39.es/ecma262/#sec-bitwise-shift-operators",
        "testScripts": [
          "tests/Jroc.Tests/BinaryOperator/ExecutionTests.cs",
          "tests/Jroc.Tests/CompoundAssignment/ExecutionTests.cs",
          "tests/Jroc.Test262.Tests/language/expressions/left-shift/ExecutionTests.cs",
          "tests/Jroc.Test262.Tests/language/expressions/right-shift/ExecutionTests.cs",
          "tests/Jroc.Test262.Tests/language/expressions/unsigned-right-shift/ExecutionTests.cs",
          "tests/Jroc.Test262.Tests/language/expressions/left-shift/OperatorExpressionsConformanceBatchExecutionTests.cs",
          "tests/Jroc.Test262.Tests/language/expressions/right-shift/OperatorExpressionsConformanceBatchExecutionTests.cs",
          "tests/Jroc.Test262.Tests/language/expressions/unsigned-right-shift/ExpressionSyntaxConformanceBatchExecutionTests.cs"
        ],
        "notes": "Left shift, signed right shift, and unsigned right shift preserve left-to-right ToNumeric coercion and abrupt completion, reject mixed Number/BigInt operands, apply modulo-based ToInt32/ToUint32 conversion, and use native IL fast paths only when static numeric types make them semantics-preserving. Unsigned right shift remains unavailable for BigInt as required by ECMA-262. The native Test262 harness additionally verifies 64 current all-variant left- and signed-right-shift fixtures plus 30 unsigned-right-shift fixtures.",
        "test262Paths": [
          "test/language/expressions/unsigned-right-shift/S9.6_A2.1.js",
          "test/language/expressions/unsigned-right-shift/S9.6_A2.2.js",
          "test/language/expressions/left-shift/S11.7.1_A5.1_T1.js",
          "test/language/expressions/left-shift/S9.5_A1_T1.js",
          "test/language/expressions/left-shift/S9.5_A2.1_T1.js",
          "test/language/expressions/left-shift/S9.5_A2.2_T1.js",
          "test/language/expressions/left-shift/S9.5_A2.3_T1.js",
          "test/language/expressions/right-shift/S11.7.2_A5.1_T1.js",
          "test/language/expressions/unsigned-right-shift/S11.7.3_A4_T1.js",
          "test/language/expressions/unsigned-right-shift/S11.7.3_A4_T2.js",
          "test/language/expressions/unsigned-right-shift/S11.7.3_A4_T3.js",
          "test/language/expressions/unsigned-right-shift/S11.7.3_A4_T4.js",
          "test/language/expressions/unsigned-right-shift/S11.7.3_A5.1_T1.js",
          "test/language/expressions/unsigned-right-shift/S11.7.3_A5.2_T1.js",
          "test/language/expressions/unsigned-right-shift/S9.6_A1.js"
        ]
      }
    ]
  }
}
