{
  "$schema": "../SectionDoc.schema.json",
  "clause": "13.11",
  "title": "Equality Operators",
  "status": "Supported",
  "specUrl": "https://tc39.es/ecma262/#sec-equality-operators",
  "parent": {
    "clause": "13"
  },
  "autoGeneratedHeader": true,
  "support": {
    "entries": [
      {
        "clause": "13.11.1",
        "feature": "Abstract equality (==) and strict equality (===) evaluation",
        "status": "Supported",
        "specUrl": "https://tc39.es/ecma262/#sec-equality-operators-runtime-semantics-evaluation",
        "testScripts": [
          "tests/Jroc.Test262.Tests/language/expressions/equals/ExecutionTests.cs",
          "tests/Jroc.Test262.Tests/language/expressions/does-not-equals/ExecutionTests.cs",
          "tests/Jroc.Test262.Tests/language/expressions/equals/PortExpressionsBatchExecutionTests.cs",
          "tests/Jroc.Test262.Tests/language/expressions/strict-equals/PortExpressionsBatchExecutionTests.cs",
          "tests/Jroc.Test262.Tests/language/expressions/equals/OperatorExpressionsConformanceBatchExecutionTests.cs",
          "tests/Jroc.Test262.Tests/language/expressions/does-not-equals/OperatorExpressionsConformanceBatchExecutionTests.cs",
          "tests/Jroc.Test262.Tests/language/expressions/strict-does-not-equals/OperatorExpressionsConformanceBatchExecutionTests.cs",
          "tests/Jroc.Test262.Tests/language/expressions/strict-does-not-equals/ExpressionSyntaxConformanceBatchExecutionTests.cs",
          "tests/Jroc.Test262.Tests/language/expressions/strict-equals/ExpressionSyntaxConformanceBatchExecutionTests.cs"
        ],
        "notes": "The checked-in equality ports cover BigInt/object/string cases, SameValue-style strict comparisons, null/undefined handling, evaluation-order errors, and object-to-primitive abstract equality in both == and != forms. The native Test262 harness additionally verifies 59 current all-variant equality fixtures plus 34 strict equality and inequality fixtures."
      }
    ]
  },
  "subclauses": [
    {
      "clause": "13.11.1",
      "title": "Runtime Semantics: Evaluation",
      "status": "Supported",
      "specUrl": "https://tc39.es/ecma262/#sec-equality-operators-runtime-semantics-evaluation"
    }
  ]
}
