{
  "$schema": "../SectionDoc.schema.json",
  "clause": "12.2",
  "title": "White Space",
  "status": "Supported with Limitations",
  "specUrl": "https://tc39.es/ecma262/#sec-white-space",
  "parent": {
    "clause": "12"
  },
  "autoGeneratedHeader": true,
  "support": {
    "entries": [
      {
        "clause": "12.2",
        "feature": "White-space lexical syntax",
        "status": "Supported with Limitations",
        "specUrl": "https://tc39.es/ecma262/#sec-white-space",
        "testScripts": [
          "tests/Jroc.Test262.Tests/language/white-space/LexicalSourceConformanceBatchTests.cs"
        ],
        "notes": "Fifty-one pinned Test262 white-space fixtures are natively verified, covering separator placement and legacy whitespace code points."
      }
    ]
  }
}
