{
  "$schema": "../SectionDoc.schema.json",
  "clause": "13.14",
  "title": "Conditional Operator ( ? : )",
  "status": "Supported",
  "specUrl": "https://tc39.es/ecma262/#sec-conditional-operator",
  "parent": {
    "clause": "13"
  },
  "autoGeneratedHeader": true,
  "subclauses": [
    {
      "clause": "13.14.1",
      "title": "Runtime Semantics: Evaluation",
      "status": "Supported",
      "specUrl": "https://tc39.es/ecma262/#sec-conditional-operator-runtime-semantics-evaluation"
    }
  ],
  "support": {
    "entries": [
      {
        "clause": "13.14.1",
        "feature": "Conditional operator (? :) evaluation",
        "status": "Supported",
        "specUrl": "https://tc39.es/ecma262/#sec-conditional-operator-runtime-semantics-evaluation",
        "testScripts": [
          "tests/Jroc.Test262.Tests/language/expressions/conditional/ExecutionTests.cs",
          "tests/Jroc.Test262.Tests/language/expressions/conditional/PortExpressionsBatchExecutionTests.cs"
        ],
        "notes": "The checked-in conditional-expression slice covers GetValue on the test expression, truthy/falsy branch selection, branch-local abrupt completions, coalesce/conditional interaction, and the tail-position return cases exercised by the imported test262 ports."
      },
      {
        "clause": "13.14",
        "feature": "Conditional-expression `in` grammar early errors",
        "status": "Supported with Limitations",
        "specUrl": "https://tc39.es/ecma262/#sec-conditional-operator",
        "testScripts": [
          "tests/Jroc.Test262.Tests/language/expressions/ExpressionSyntaxConformance7BatchParseTests.cs"
        ],
        "test262Paths": [
          "test/language/expressions/conditional/in-branch-2.js",
          "test/language/expressions/conditional/in-condition.js"
        ],
        "notes": "The native Test262 harness rejects two pinned parse-negative conditional-expression forms that use `in` where the grammar disallows it."
      }
    ]
  }
}
