{
  "$schema": "../SectionDoc.schema.json",
  "clause": "9.8",
  "title": "Forward Progress",
  "status": "Supported with Limitations",
  "specUrl": "https://tc39.es/ecma262/#sec-forward-progress",
  "parent": {
    "clause": "9"
  },
  "autoGeneratedHeader": true,
  "support": {
    "entries": [
      {
        "clause": "9.8",
        "feature": "Forward progress in event-loop/microtask scheduling",
        "status": "Supported with Limitations",
        "specUrl": "https://tc39.es/ecma262/#sec-forward-progress",
        "testScripts": [
          "tests/Jroc.Tests/Promise/JavaScript/Promise_Scheduling_StarvationTest.js",
          "tests/Jroc.Tests/Hosting/JavaScript/Hosting_EventLoopKeepAlive.js",
          "tests/Jroc.Tests/RuntimeAgentSchedulingTests.cs",
          "tests/Jroc.Tests/RuntimeAgentClusterSharedServicesTests.cs"
        ],
        "notes": "Each agent owns a NodeEventLoopPump and scheduling queues. Pumps bound work per checkpoint; independent executors drain their own callbacks, and cross-agent Atomics notifications wake matching waiters. These implemented scheduling paths do not establish every ECMAScript multi-agent forward-progress guarantee."
      }
    ]
  }
}
