{
  "$schema": "../SectionDoc.schema.json",
  "clause": "29.1",
  "title": "Memory Model Fundamentals",
  "status": "Not Yet Supported",
  "specUrl": "https://tc39.es/ecma262/#sec-memory-model-fundamentals",
  "parent": {
    "clause": "29"
  },
  "autoGeneratedHeader": true,
  "intro": "JROC implements SharedArrayBuffer and several Atomics operations, but full multi-agent shared-memory execution and ECMA-262 memory-model conformance remain unverified.",
  "support": {
    "entries": [
      {
        "clause": "29.1",
        "feature": "Shared-memory memory-model semantics",
        "status": "Not Yet Supported",
        "specUrl": "https://tc39.es/ecma262/#sec-memory-model-fundamentals",
        "notes": "Growable SharedArrayBuffer, integer typed-array atomic operations, and Atomics.wait/waitAsync/notify are available. Full multi-agent memory-model conformance, including cross-agent ordering guarantees, is not yet verified."
      }
    ]
  }
}
