{
  "$schema": "../SectionDoc.schema.json",
  "clause": "12.3",
  "title": "Line Terminators",
  "status": "Supported with Limitations",
  "specUrl": "https://tc39.es/ecma262/#sec-line-terminators",
  "parent": {
    "clause": "12"
  },
  "autoGeneratedHeader": true,
  "support": {
    "entries": [
      {
        "clause": "12.3",
        "feature": "Line-terminator lexical syntax",
        "status": "Supported with Limitations",
        "specUrl": "https://tc39.es/ecma262/#sec-line-terminators",
        "testScripts": [
          "tests/Jroc.Test262.Tests/language/line-terminators/LexicalSourceConformanceBatchTests.cs"
        ],
        "notes": "Twenty-five pinned Test262 line-terminator fixtures are natively verified, including CR, LF, CRLF, line separator, and paragraph separator behavior."
      }
    ]
  }
}
