{
  "$schema": "../SectionDoc.schema.json",
  "clause": "4.3",
  "title": "ECMAScript Overview",
  "status": "N/A (informational)",
  "specUrl": "https://tc39.es/ecma262/#sec-ecmascript-overview",
  "parent": {
    "clause": "4"
  },
  "autoGeneratedHeader": true,
  "subclauses": [
    {
      "clause": "4.3.1",
      "title": "Objects",
      "status": "N/A (informational)",
      "specUrl": "https://tc39.es/ecma262/#sec-objects"
    },
    {
      "clause": "4.3.2",
      "title": "The Strict Variant of ECMAScript",
      "status": "N/A (informational)",
      "specUrl": "https://tc39.es/ecma262/#sec-strict-variant-of-ecmascript"
    }
  ]
}
