{
  "$schema": "../SectionDoc.schema.json",
  "clause": "5.1",
  "title": "Syntactic and Lexical Grammars",
  "status": "N/A (informational)",
  "specUrl": "https://tc39.es/ecma262/#sec-syntactic-and-lexical-grammars",
  "parent": {
    "clause": "5"
  },
  "autoGeneratedHeader": true,
  "subclauses": [
    {
      "clause": "5.1.1",
      "title": "Context-Free Grammars",
      "status": "N/A (informational)",
      "specUrl": "https://tc39.es/ecma262/#sec-context-free-grammars"
    },
    {
      "clause": "5.1.2",
      "title": "The Lexical and RegExp Grammars",
      "status": "N/A (informational)",
      "specUrl": "https://tc39.es/ecma262/#sec-lexical-and-regexp-grammars"
    },
    {
      "clause": "5.1.3",
      "title": "The Numeric String Grammar",
      "status": "N/A (informational)",
      "specUrl": "https://tc39.es/ecma262/#sec-numeric-string-grammar"
    },
    {
      "clause": "5.1.4",
      "title": "The Syntactic Grammar",
      "status": "N/A (informational)",
      "specUrl": "https://tc39.es/ecma262/#sec-syntactic-grammar"
    },
    {
      "clause": "5.1.5",
      "title": "Grammar Notation",
      "status": "N/A (informational)",
      "specUrl": "https://tc39.es/ecma262/#sec-grammar-notation"
    },
    {
      "clause": "5.1.5.1",
      "title": "Terminal Symbols",
      "status": "N/A (informational)",
      "specUrl": "https://tc39.es/ecma262/#sec-terminal-symbols"
    },
    {
      "clause": "5.1.5.2",
      "title": "Nonterminal Symbols and Productions",
      "status": "N/A (informational)",
      "specUrl": "https://tc39.es/ecma262/#sec-nonterminal-symbols-and-productions"
    },
    {
      "clause": "5.1.5.3",
      "title": "Optional Symbols",
      "status": "N/A (informational)",
      "specUrl": "https://tc39.es/ecma262/#sec-optional-symbols"
    },
    {
      "clause": "5.1.5.4",
      "title": "Grammatical Parameters",
      "status": "N/A (informational)",
      "specUrl": "https://tc39.es/ecma262/#sec-grammatical-parameters"
    },
    {
      "clause": "5.1.5.5",
      "title": "one of",
      "status": "N/A (informational)",
      "specUrl": "https://tc39.es/ecma262/#sec-one-of"
    },
    {
      "clause": "5.1.5.6",
      "title": "[empty]",
      "status": "N/A (informational)",
      "specUrl": "https://tc39.es/ecma262/#sec-empty"
    },
    {
      "clause": "5.1.5.7",
      "title": "Lookahead Restrictions",
      "status": "N/A (informational)",
      "specUrl": "https://tc39.es/ecma262/#sec-lookahead-restrictions"
    },
    {
      "clause": "5.1.5.8",
      "title": "[no LineTerminator here]",
      "status": "N/A (informational)",
      "specUrl": "https://tc39.es/ecma262/#sec-no-lineterminator-here"
    },
    {
      "clause": "5.1.5.9",
      "title": "but not",
      "status": "N/A (informational)",
      "specUrl": "https://tc39.es/ecma262/#sec-but-not"
    },
    {
      "clause": "5.1.5.10",
      "title": "Descriptive Phrases",
      "status": "N/A (informational)",
      "specUrl": "https://tc39.es/ecma262/#sec-descriptive-phrases"
    }
  ]
}
