{
  "$schema": "../SectionDoc.schema.json",
  "clause": "15.1",
  "title": "Parameter Lists",
  "status": "Supported with Limitations",
  "specUrl": "https://tc39.es/ecma262/#sec-parameter-lists",
  "parent": {
    "clause": "15"
  },
  "autoGeneratedHeader": true,
  "subclauses": [
    {
      "clause": "15.1.1",
      "title": "Static Semantics: Early Errors",
      "status": "Supported with Limitations",
      "specUrl": "https://tc39.es/ecma262/#sec-parameter-lists-static-semantics-early-errors"
    },
    {
      "clause": "15.1.2",
      "title": "Static Semantics: ContainsExpression",
      "status": "Supported with Limitations",
      "specUrl": "https://tc39.es/ecma262/#sec-static-semantics-containsexpression"
    },
    {
      "clause": "15.1.3",
      "title": "Static Semantics: IsSimpleParameterList",
      "status": "Supported with Limitations",
      "specUrl": "https://tc39.es/ecma262/#sec-static-semantics-issimpleparameterlist"
    },
    {
      "clause": "15.1.4",
      "title": "Static Semantics: HasInitializer",
      "status": "Supported with Limitations",
      "specUrl": "https://tc39.es/ecma262/#sec-static-semantics-hasinitializer"
    },
    {
      "clause": "15.1.5",
      "title": "Static Semantics: ExpectedArgumentCount",
      "status": "Supported with Limitations",
      "specUrl": "https://tc39.es/ecma262/#sec-static-semantics-expectedargumentcount"
    }
  ],
  "support": {
    "entries": [
      {
        "clause": "15.1",
        "feature": "duplicate simple parameters and function declaration instantiation",
        "status": "Supported with Limitations",
        "test262Paths": [
          "test/language/function-code/S10.2.1_A2.js",
          "test/language/function-code/S10.2.1_A3.js",
          "test/language/function-code/S10.2.1_A4_T1.js",
          "test/language/function-code/S10.2.1_A4_T2.js"
        ],
        "notes": "Permitted duplicate simple parameter names resolve to the final argument position, including an omitted final argument. Hoisted function declarations replace like-named parameters and are not cleared by var declarations without initializers. Duplicate parameter lists avoid unsafe per-position primitive signature inference. Function-code conformance is 204 passing cases and 13 explicit eval exclusions."
      },
      {
        "clause": "15.1",
        "feature": "simple parameter lists (<= 32 params)",
        "status": "Supported with Limitations",
        "specUrl": "https://tc39.es/ecma262/#sec-parameter-lists",
        "testScripts": [
          "tests/Jroc.Tests/Function/JavaScript/Function_GlobalFunctionWithParameter.js",
          "tests/Jroc.Tests/Function/JavaScript/Function_GlobalFunctionWithMultipleParameters.js",
          "tests/Jroc.Tests/ArrowFunction/JavaScript/ArrowFunction_GlobalFunctionWithMultipleParameters.js",
          "tests/Jroc.Tests/Function/JavaScript/Function_MaxParameters_16.js",
          "tests/Jroc.Tests/Function/JavaScript/Function_MaxParameters_32_CallViaVariable.js",
          "tests/Jroc.Tests/ArrowFunction/JavaScript/ArrowFunction_MaxParameters_32.js",
          "tests/Jroc.Tests/Classes/JavaScript/Classes_ClassMethod_MaxParameters_32.js"
        ],
        "notes": "JROC supports simple parameter lists but enforces a current limit of 32 parameters (validator)."
      },
      {
        "clause": "15.1.4",
        "feature": "default parameter values",
        "status": "Supported",
        "specUrl": "https://tc39.es/ecma262/#sec-static-semantics-hasinitializer",
        "testScripts": [
          "tests/Jroc.Tests/Function/JavaScript/Function_DefaultParameterValue.js",
          "tests/Jroc.Tests/ArrowFunction/JavaScript/ArrowFunction_DefaultParameterValue.js"
        ]
      },
      {
        "clause": "15.1.2",
        "feature": "default parameter expressions (can reference earlier params)",
        "status": "Supported",
        "specUrl": "https://tc39.es/ecma262/#sec-static-semantics-containsexpression",
        "testScripts": [
          "tests/Jroc.Tests/Function/JavaScript/Function_DefaultParameterExpression.js",
          "tests/Jroc.Tests/ArrowFunction/JavaScript/ArrowFunction_DefaultParameterExpression.js"
        ]
      },
      {
        "clause": "15.1",
        "feature": "object destructuring in parameters",
        "status": "Supported",
        "specUrl": "https://tc39.es/ecma262/#sec-parameter-lists",
        "testScripts": [
          "tests/Jroc.Tests/Function/JavaScript/Function_ParameterDestructuring_Object.js",
          "tests/Jroc.Tests/ArrowFunction/JavaScript/ArrowFunction_ParameterDestructuring_Object.js"
        ]
      },
      {
        "clause": "15.1",
        "feature": "rest parameters (...args)",
        "status": "Supported",
        "specUrl": "https://tc39.es/ecma262/#sec-parameter-lists",
        "testScripts": [
          "tests/Jroc.Tests/Function/JavaScript/Function_RestParameters_Basic.js",
          "tests/Jroc.Tests/Function/JavaScript/Function_RestParameters_Empty.js",
          "tests/Jroc.Tests/Function/JavaScript/Function_RestParameters_WithNamedParams.js",
          "tests/Jroc.Tests/Function/JavaScript/Function_RestParameters_MultipleNamed.js",
          "tests/Jroc.Tests/ArrowFunction/JavaScript/ArrowFunction_RestParameters_Basic.js",
          "tests/Jroc.Tests/ArrowFunction/JavaScript/ArrowFunction_RestParameters_WithNamedParams.js"
        ],
        "notes": "Rest parameters (...args) are fully supported in function declarations, function expressions, and arrow functions. Remaining arguments are collected into a JavaScript Array and are available for normal array operations and iteration."
      }
    ]
  }
}
