{
  "$schema": "../SectionDoc.schema.json",
  "clause": "14.8",
  "title": "The continue Statement",
  "status": "Supported",
  "specUrl": "https://tc39.es/ecma262/#sec-continue-statement",
  "parent": {
    "clause": "14"
  },
  "autoGeneratedHeader": true,
  "subclauses": [
    {
      "clause": "14.8.1",
      "title": "Static Semantics: Early Errors",
      "status": "Supported with Limitations",
      "specUrl": "https://tc39.es/ecma262/#sec-continue-statement-static-semantics-early-errors"
    },
    {
      "clause": "14.8.2",
      "title": "Runtime Semantics: Evaluation",
      "status": "Supported",
      "specUrl": "https://tc39.es/ecma262/#sec-continue-statement-runtime-semantics-evaluation"
    }
  ],
  "support": {
    "entries": [
      {
        "clause": "14.8.2",
        "feature": "continue statement (unlabeled)",
        "status": "Supported",
        "specUrl": "https://tc39.es/ecma262/#sec-continue-statement-runtime-semantics-evaluation",
        "testScripts": [
          "tests/Jroc.Tests/ControlFlow/JavaScript/ControlFlow_ForLoop_Continue_SkipEven.js",
          "tests/Jroc.Tests/ControlFlow/JavaScript/ControlFlow_While_Continue_SkipEven.js",
          "tests/Jroc.Tests/ControlFlow/JavaScript/ControlFlow_DoWhile_Continue_SkipEven.js"
        ]
      },
      {
        "clause": "14.8.2",
        "feature": "continue statement (labeled)",
        "status": "Supported",
        "specUrl": "https://tc39.es/ecma262/#sec-continue-statement-runtime-semantics-evaluation",
        "testScripts": [
          "tests/Jroc.Tests/ControlFlow/JavaScript/ControlFlow_ForLoop_LabeledContinue.js",
          "tests/Jroc.Tests/ControlFlow/JavaScript/ControlFlow_While_LabeledContinue.js",
          "tests/Jroc.Tests/ControlFlow/JavaScript/ControlFlow_DoWhile_LabeledContinue.js",
          "tests/Jroc.Tests/ControlFlow/JavaScript/ControlFlow_ForOf_LabeledContinue.js",
          "tests/Jroc.Tests/ControlFlow/JavaScript/ControlFlow_ForIn_LabeledContinue.js"
        ],
        "notes": "Labeled continue targets an enclosing iteration statement; implemented via loop context label mapping during lowering."
      },
      {
        "clause": "14.8.2",
        "feature": "continue through catch blocks and line terminators",
        "status": "Supported",
        "specUrl": "https://tc39.es/ecma262/#sec-continue-statement-runtime-semantics-evaluation",
        "testScripts": [
          "tests/Jroc.Test262.Tests/language/statements/continue/JavaScript/S12.7_A9_T1.js",
          "tests/Jroc.Test262.Tests/language/statements/continue/JavaScript/S12.7_A9_T2.js",
          "tests/Jroc.Test262.Tests/language/statements/continue/JavaScript/line-terminators.js"
        ],
        "notes": "The added test262 ports cover labeled and unlabeled continue from catch blocks and the line-terminator cases where `continue` must not retain the following label."
      },
      {
        "clause": "14.8.1",
        "feature": "continue statement early errors",
        "status": "Supported",
        "specUrl": "https://tc39.es/ecma262/#sec-continue-statement-static-semantics-early-errors",
        "testScripts": [
          "tests/Jroc.Test262.Tests/language/statements/continue/JavaScript/S12.7_A1_T1.js",
          "tests/Jroc.Test262.Tests/language/statements/continue/JavaScript/S12.7_A1_T2.js",
          "tests/Jroc.Test262.Tests/language/statements/continue/JavaScript/S12.7_A5_T1.js",
          "tests/Jroc.Test262.Tests/language/statements/continue/JavaScript/S12.7_A5_T2.js",
          "tests/Jroc.Test262.Tests/language/statements/continue/JavaScript/S12.7_A6.js"
        ],
        "notes": "The added test262 ports cover parser rejection for continue outside iteration statements and for continue targets that do not resolve to an enclosing iteration label."
      },
      {
        "clause": "14.8",
        "feature": "Statement syntax parse-negative conformance expansion",
        "status": "Supported with Limitations",
        "specUrl": "https://tc39.es/ecma262/#sec-continue-statement",
        "testScripts": [
          "tests/Jroc.Test262.Tests/language/statements/StatementSyntaxConformance8BatchParseTests.cs"
        ],
        "test262Paths": [
          "test/language/statements/continue/S12.7_A1_T3.js",
          "test/language/statements/continue/S12.7_A1_T4.js"
        ],
        "notes": "The native Test262 harness verifies 7 additional pinned parse-negative statement fixtures (7 `continue`). All 14 metadata-selected variants passed the catalog preflight under one current compiler provenance; no compiler, runtime, or harness changes were required."
      }
    ]
  }
}
