{
  "$schema": "../SectionDoc.schema.json",
  "clause": "9.9",
  "title": "Processing Model of WeakRef and FinalizationRegistry Targets",
  "status": "Supported with Limitations",
  "specUrl": "https://tc39.es/ecma262/#sec-weakref-processing-model",
  "parent": {
    "clause": "9"
  },
  "autoGeneratedHeader": true,
  "subclauses": [
    {
      "clause": "9.9.1",
      "title": "Objectives",
      "status": "Supported with Limitations",
      "specUrl": "https://tc39.es/ecma262/#sec-weakref-invariants"
    },
    {
      "clause": "9.9.2",
      "title": "Liveness",
      "status": "Supported with Limitations",
      "specUrl": "https://tc39.es/ecma262/#sec-liveness"
    },
    {
      "clause": "9.9.3",
      "title": "Execution",
      "status": "Supported with Limitations",
      "specUrl": "https://tc39.es/ecma262/#sec-weakref-execution"
    },
    {
      "clause": "9.9.4",
      "title": "Host Hooks",
      "status": "Supported with Limitations",
      "specUrl": "https://tc39.es/ecma262/#sec-weakref-host-hooks"
    },
    {
      "clause": "9.9.4.1",
      "title": "HostEnqueueFinalizationRegistryCleanupJob ( finalizationRegistry )",
      "status": "Supported with Limitations",
      "specUrl": "https://tc39.es/ecma262/#sec-host-cleanup-finalization-registry"
    }
  ],
  "support": {
    "entries": [
      {
        "clause": "9.9",
        "feature": "WeakRef/FinalizationRegistry processing model",
        "status": "Supported with Limitations",
        "specUrl": "https://tc39.es/ecma262/#sec-weakref-processing-model",
        "testScripts": [
          "tests/Jroc.Tests/WeakRef/JavaScript/WeakRef_Deref_KeptObjects.js",
          "tests/Jroc.Tests/FinalizationRegistry/JavaScript/FinalizationRegistry_Cleanup_Order.js"
        ],
        "notes": "Implements a host-managed WeakRef/FinalizationRegistry processing model with kept objects, a cleanup-job queue, and deterministic test forcing via a host-opt-in non-standard global `gc()` helper. Cleanup timing outside that helper still depends on .NET GC and active event-loop checkpoints, so the model remains host-safe rather than fully browser/Node equivalent."
      }
    ]
  }
}
